[
  {
    "schema_version": "0.1.0",
    "data_origin": "synthetic_demo",
    "id": "event-demo-01-interview-completed",
    "sequence": 1,
    "previous_event_id": null,
    "occurred_at": "2026-10-01T14:10:00Z",
    "actor": {
      "kind": "operator",
      "id": "operator-maria-fernanda-rios"
    },
    "action": "interview_completed",
    "entity": {
      "kind": "interview",
      "id": "interview-demo-01"
    },
    "case_id": "case-demo-01",
    "payload": {
      "outcome": null,
      "position": null,
      "related_record_id": null,
      "note": "Fictional event used to verify the workflow."
    }
  },
  {
    "schema_version": "0.1.0",
    "data_origin": "synthetic_demo",
    "id": "event-demo-01-sentiment-recorded",
    "sequence": 2,
    "previous_event_id": "event-demo-01-interview-completed",
    "occurred_at": "2026-10-01T14:12:00Z",
    "actor": {
      "kind": "service",
      "id": "service-demo-sentiment"
    },
    "action": "sentiment_recorded",
    "entity": {
      "kind": "interview",
      "id": "interview-demo-01"
    },
    "case_id": "case-demo-01",
    "payload": {
      "outcome": null,
      "position": null,
      "related_record_id": "sentiment-demo-01",
      "note": "Fictional event used to verify the workflow."
    }
  },
  {
    "schema_version": "0.1.0",
    "data_origin": "synthetic_demo",
    "id": "event-demo-01-ai-generated",
    "sequence": 3,
    "previous_event_id": "event-demo-01-sentiment-recorded",
    "occurred_at": "2026-10-01T14:14:00Z",
    "actor": {
      "kind": "service",
      "id": "service-demo-cashy"
    },
    "action": "ai_generated",
    "entity": {
      "kind": "ai_assessment",
      "id": "ai-demo-01"
    },
    "case_id": "case-demo-01",
    "payload": {
      "outcome": null,
      "position": null,
      "related_record_id": null,
      "note": "Fictional event used to verify the workflow."
    }
  },
  {
    "schema_version": "0.1.0",
    "data_origin": "synthetic_demo",
    "id": "event-demo-01-case-viewed",
    "sequence": 4,
    "previous_event_id": "event-demo-01-ai-generated",
    "occurred_at": "2026-10-01T14:15:00Z",
    "actor": {
      "kind": "operator",
      "id": "operator-daniel-herrera"
    },
    "action": "case_viewed",
    "entity": {
      "kind": "decision",
      "id": "decision-demo-01"
    },
    "case_id": "case-demo-01",
    "payload": {
      "outcome": null,
      "position": null,
      "related_record_id": "snapshot-demo-01",
      "note": "Only case facts shown; no Cashy output available to the operator."
    }
  },
  {
    "schema_version": "0.1.0",
    "data_origin": "synthetic_demo",
    "id": "event-demo-01-independent-assessment-submitted",
    "sequence": 5,
    "previous_event_id": "event-demo-01-case-viewed",
    "occurred_at": "2026-10-01T14:17:00Z",
    "actor": {
      "kind": "operator",
      "id": "operator-daniel-herrera"
    },
    "action": "independent_assessment_submitted",
    "entity": {
      "kind": "decision",
      "id": "decision-demo-01"
    },
    "case_id": "case-demo-01",
    "payload": {
      "outcome": "include",
      "position": null,
      "related_record_id": null,
      "note": "Fictional event used to verify the workflow."
    }
  },
  {
    "schema_version": "0.1.0",
    "data_origin": "synthetic_demo",
    "id": "event-demo-01-ai-revealed",
    "sequence": 6,
    "previous_event_id": "event-demo-01-independent-assessment-submitted",
    "occurred_at": "2026-10-01T14:18:00Z",
    "actor": {
      "kind": "operator",
      "id": "operator-daniel-herrera"
    },
    "action": "ai_revealed",
    "entity": {
      "kind": "decision",
      "id": "decision-demo-01"
    },
    "case_id": "case-demo-01",
    "payload": {
      "outcome": null,
      "position": null,
      "related_record_id": "ai-demo-01",
      "note": "First view of the recommendation and reasoning in separate panels."
    }
  },
  {
    "schema_version": "0.1.0",
    "data_origin": "synthetic_demo",
    "id": "event-demo-01-reasoning-judged",
    "sequence": 7,
    "previous_event_id": "event-demo-01-ai-revealed",
    "occurred_at": "2026-10-01T14:19:00Z",
    "actor": {
      "kind": "operator",
      "id": "operator-daniel-herrera"
    },
    "action": "reasoning_judged",
    "entity": {
      "kind": "decision",
      "id": "decision-demo-01"
    },
    "case_id": "case-demo-01",
    "payload": {
      "outcome": null,
      "position": "disagree",
      "related_record_id": null,
      "note": "Fictional event used to verify the workflow."
    }
  },
  {
    "schema_version": "0.1.0",
    "data_origin": "synthetic_demo",
    "id": "event-demo-01-answer-judged",
    "sequence": 8,
    "previous_event_id": "event-demo-01-reasoning-judged",
    "occurred_at": "2026-10-01T14:20:00Z",
    "actor": {
      "kind": "operator",
      "id": "operator-daniel-herrera"
    },
    "action": "answer_judged",
    "entity": {
      "kind": "decision",
      "id": "decision-demo-01"
    },
    "case_id": "case-demo-01",
    "payload": {
      "outcome": null,
      "position": "disagree",
      "related_record_id": null,
      "note": "Fictional event used to verify the workflow."
    }
  },
  {
    "schema_version": "0.1.0",
    "data_origin": "synthetic_demo",
    "id": "event-demo-01-decision-finalized",
    "sequence": 9,
    "previous_event_id": "event-demo-01-answer-judged",
    "occurred_at": "2026-10-01T14:22:00Z",
    "actor": {
      "kind": "operator",
      "id": "operator-daniel-herrera"
    },
    "action": "decision_finalized",
    "entity": {
      "kind": "decision",
      "id": "decision-demo-01"
    },
    "case_id": "case-demo-01",
    "payload": {
      "outcome": "include",
      "position": null,
      "related_record_id": null,
      "note": "Fictional event used to verify the workflow."
    }
  },
  {
    "schema_version": "0.1.0",
    "data_origin": "synthetic_demo",
    "id": "event-demo-02-interview-completed",
    "sequence": 10,
    "previous_event_id": "event-demo-01-decision-finalized",
    "occurred_at": "2026-10-01T15:10:00Z",
    "actor": {
      "kind": "operator",
      "id": "operator-maria-fernanda-rios"
    },
    "action": "interview_completed",
    "entity": {
      "kind": "interview",
      "id": "interview-demo-02"
    },
    "case_id": "case-demo-02",
    "payload": {
      "outcome": null,
      "position": null,
      "related_record_id": null,
      "note": "Fictional event used to verify the workflow."
    }
  },
  {
    "schema_version": "0.1.0",
    "data_origin": "synthetic_demo",
    "id": "event-demo-02-sentiment-recorded",
    "sequence": 11,
    "previous_event_id": "event-demo-02-interview-completed",
    "occurred_at": "2026-10-01T15:12:00Z",
    "actor": {
      "kind": "service",
      "id": "service-demo-sentiment"
    },
    "action": "sentiment_recorded",
    "entity": {
      "kind": "interview",
      "id": "interview-demo-02"
    },
    "case_id": "case-demo-02",
    "payload": {
      "outcome": null,
      "position": null,
      "related_record_id": "sentiment-demo-02",
      "note": "Fictional event used to verify the workflow."
    }
  },
  {
    "schema_version": "0.1.0",
    "data_origin": "synthetic_demo",
    "id": "event-demo-02-ai-generated",
    "sequence": 12,
    "previous_event_id": "event-demo-02-sentiment-recorded",
    "occurred_at": "2026-10-01T15:14:00Z",
    "actor": {
      "kind": "service",
      "id": "service-demo-cashy"
    },
    "action": "ai_generated",
    "entity": {
      "kind": "ai_assessment",
      "id": "ai-demo-02"
    },
    "case_id": "case-demo-02",
    "payload": {
      "outcome": null,
      "position": null,
      "related_record_id": null,
      "note": "Fictional event used to verify the workflow."
    }
  },
  {
    "schema_version": "0.1.0",
    "data_origin": "synthetic_demo",
    "id": "event-demo-02-case-viewed",
    "sequence": 13,
    "previous_event_id": "event-demo-02-ai-generated",
    "occurred_at": "2026-10-01T15:15:00Z",
    "actor": {
      "kind": "operator",
      "id": "operator-daniel-herrera"
    },
    "action": "case_viewed",
    "entity": {
      "kind": "decision",
      "id": "decision-demo-02"
    },
    "case_id": "case-demo-02",
    "payload": {
      "outcome": null,
      "position": null,
      "related_record_id": "snapshot-demo-02",
      "note": "Only case facts shown; no Cashy output available to the operator."
    }
  },
  {
    "schema_version": "0.1.0",
    "data_origin": "synthetic_demo",
    "id": "event-demo-02-independent-assessment-submitted",
    "sequence": 14,
    "previous_event_id": "event-demo-02-case-viewed",
    "occurred_at": "2026-10-01T15:17:00Z",
    "actor": {
      "kind": "operator",
      "id": "operator-daniel-herrera"
    },
    "action": "independent_assessment_submitted",
    "entity": {
      "kind": "decision",
      "id": "decision-demo-02"
    },
    "case_id": "case-demo-02",
    "payload": {
      "outcome": "include",
      "position": null,
      "related_record_id": null,
      "note": "Fictional event used to verify the workflow."
    }
  },
  {
    "schema_version": "0.1.0",
    "data_origin": "synthetic_demo",
    "id": "event-demo-02-ai-revealed",
    "sequence": 15,
    "previous_event_id": "event-demo-02-independent-assessment-submitted",
    "occurred_at": "2026-10-01T15:18:00Z",
    "actor": {
      "kind": "operator",
      "id": "operator-daniel-herrera"
    },
    "action": "ai_revealed",
    "entity": {
      "kind": "decision",
      "id": "decision-demo-02"
    },
    "case_id": "case-demo-02",
    "payload": {
      "outcome": null,
      "position": null,
      "related_record_id": "ai-demo-02",
      "note": "First view of the recommendation and reasoning in separate panels."
    }
  },
  {
    "schema_version": "0.1.0",
    "data_origin": "synthetic_demo",
    "id": "event-demo-02-reasoning-judged",
    "sequence": 16,
    "previous_event_id": "event-demo-02-ai-revealed",
    "occurred_at": "2026-10-01T15:19:00Z",